こうのいけじどうゆうえんち,鴻池児童遊園地,鴻池6丁目224、226、231,34.800595,135.38495,児童遊園地
こやばばぐちじどうゆうえんち,昆陽馬場口児童遊園地,昆陽7丁目44-2,34.778645,135.393921,児童遊園地
こだまじどうゆうえんち,こだま児童遊園地,南野北4丁目218,34.768573,135.400262,児童遊園地
そとがわらじどうゆうえんち,外川原児童遊園地,西野7丁目31,34.785997,135.372832,児童遊園地
こやのさとじどうゆうえんち,昆陽里児童遊園地,山田5丁目34-1の一部,34.772687,135.384552,児童遊園地
たつみかきうちじどうゆうえんち,辰己垣内児童遊園地,御願塚8丁目地内,34.766207,135.410145,児童遊園地
つばめじどうゆうえんち,つばめ児童遊園地,野間北4丁目129-1,34.767959,135.393794,児童遊園地
ひがしのじどうゆうえんち,東野児童遊園地,東野5丁目76,34.802292,135.398032,児童遊園地
ふじじどうゆうえんち,ふじ児童遊園地,御願塚3丁目933-2,34.768099,135.41313,児童遊園地
ほったなかじどうゆうえんち,堀田中児童遊園地,荒牧1丁目地先,34.806848,135.380013,児童遊園地
しもがわらひがしじどうゆうえんち,下河原東児童遊園地,下河原3丁目155,34.798796,135.43074,児童遊園地
てらもと（Ⅲ）じどうゆうえんち,寺本（Ⅲ）児童遊園地,"寺本1丁目87,88-1,88-2",34.77465,135.388507,児童遊園地
きたむら（Ⅰ）じどうゆうえんち,北村（Ⅰ）児童遊園地,北伊丹3丁目79-2,34.794663,135.4166,児童遊園地
ひがしくわづ（Ⅰ）じどうゆうえんち,東桑津（Ⅰ）児童遊園地,桑津1丁目289-33、289-45,34.784672,135.42767,児童遊園地
にしのさんかくひろば,西野三角広場,西野5丁目276,34.790835,135.372424,児童遊園地
こまつばらじどうゆうえんち,小松原児童遊園地,西野6丁目234、235,34.791886,135.371999,児童遊園地
さくらざきじどうゆうえんち,桜崎児童遊園地,宮ノ前3丁目1の一部,34.784884,135.414679,児童遊園地
やまだじどうゆうえんち,山田児童遊園地,"山田4丁目34の一部，尼崎市武庫之荘9丁目257-1の一部、258-1,258-4",34.770517,135.387541,児童遊園地
さくらがおか（Ⅱ）じどうゆうえんち,桜ケ丘（Ⅱ）児童遊園地,桜ケ丘5丁目30、30-1,34.785773,135.409217,児童遊園地
ちょうせいじどうゆうえんち,長勢児童遊園地,昆陽6丁目10-1,34.780063,135.397367,児童遊園地
えあふろんとおあしす（しもがわら）,エアフロントオアシス(下河原),下河原3丁目101,34.797928,135.429324,公園外管理地
みどりのぷらざ,みどりのプラザ,荒牧6丁目4-12,34.810826,135.38676,公園外管理地
